{
  "version": 1,
  "canvas": {
    "width_px": 1600,
    "height_px": 900,
    "px_per_inch": 100,
    "background": "#FFFFFF"
  },
  "metadata": {
    "title": "Pixel-perfect editable reconstruction",
    "creator": "Pixel-Perfect Diagram Replica Skill"
  },
  "fonts": ["Times New Roman", "Arial"],
  "pages": [
    {
      "name": "Editable 1-to-1",
      "elements": []
    },
    {
      "name": "Original Pixel Reference",
      "reference_image": true
    }
  ]
}
